{
  "schemaVersion": "1.0",
  "source": "tradingview",
  "eventId": "OANDA:XAUUSD|15|1794902700000|STRATEGY",
  "webhookSecret": null,
  "symbol": "XAUUSD",
  "exchange": "OANDA",
  "timeframe": "15",
  "eventType": "BAR_CLOSE",
  "barTime": "2026-07-20T14:45:00Z",
  "sentAt": "2026-07-20T14:45:02Z",
  "isConfirmedBar": true,
  "indicatorName": "GoldMetaBridge",
  "ohlcv": {
    "open": 2417.32,
    "high": 2421.86,
    "low": 2415.74,
    "close": 2420.48,
    "volume": 18472
  },
  "levels": {
    "pocAll": 2416.5,
    "vahAll": 2420.0,
    "valAll": 2412.0,
    "pocNonBroken": [],
    "vahNonBroken": [],
    "valNonBroken": []
  },
  "sessionVolumeProfile": {
    "session": "OVERLAP",
    "sessionStart": "2026-07-20T13:00:00Z",
    "sessionEnd": "2026-07-20T14:45:00Z",
    "poc": 2416.5,
    "vah": 2420.0,
    "val": 2412.0,
    "hvn": [],
    "lvn": [],
    "acceptanceState": "ACCEPTANCE"
  },
  "marketProfile": {
    "tpoPoc": null,
    "initialBalanceHigh": null,
    "initialBalanceLow": null,
    "poorHigh": null,
    "poorLow": null,
    "singlePrints": [],
    "valueMigration": "UNKNOWN",
    "profileState": "UNKNOWN",
    "acceptanceState": "UNKNOWN"
  },
  "trend": {
    "direction": "BULLISH",
    "strength": 72,
    "components": [
      {
        "name": "gm_direction_1h",
        "direction": "BULLISH",
        "strength": 70,
        "sourceTimeframe": "60"
      },
      {
        "name": "gm_structure_15m",
        "direction": "BULLISH",
        "strength": 78,
        "sourceTimeframe": "15"
      },
      {
        "name": "gm_entry_5m",
        "direction": "NEUTRAL",
        "strength": 40,
        "sourceTimeframe": "5"
      }
    ]
  },
  "confirmationCandle": {
    "confirmed": true,
    "direction": "BULLISH",
    "candleType": null,
    "classification": "CONTINUATION",
    "open": 2417.32,
    "high": 2421.86,
    "low": 2415.74,
    "close": 2420.48,
    "bodyPercent": 51.63,
    "upperWickPercent": 22.55,
    "lowerWickPercent": 25.82,
    "volume": 18472,
    "isClosed": true,
    "relatedLevel": null
  },
  "optionalIndicators": {
    "atr": { "length": 14, "value": 5.84 },
    "vwap": { "session": "OVERLAP", "value": 2418.12 },
    "ema21": 2416.8,
    "ema50": 2412.4,
    "ema200": 2405.1,
    "rsi": { "length": 14, "value": 58.2 },
    "adx": { "length": 14, "value": 24.5, "diPlus": 22.1, "diMinus": 18.3 },
    "volume": { "value": 18472, "relative": 1.12, "smaLength": 20 },
    "developingVolumeProfile": {
      "poc": 2416.5,
      "vah": 2420.0,
      "val": 2412.0,
      "developing": true,
      "overflow": false
    },
    "session": {
      "heuristic": "UTC_HOUR",
      "name": "OVERLAP",
      "high": 2422.1,
      "low": 2410.5
    },
    "dayLevels": {
      "previousDayHigh": 2435.0,
      "previousDayLow": 2398.0,
      "currentDayHigh": 2422.1,
      "currentDayLow": 2410.5
    },
    "openingRange": {
      "high": 2414.2,
      "low": 2408.6,
      "locked": true,
      "minutes": 30
    },
    "structure": {
      "swingLength": 5,
      "lastSwingHigh": 2421.5,
      "lastSwingLow": 2411.2,
      "breakoutState": "NONE",
      "rejectionState": "NONE",
      "retestState": "NONE",
      "openingRangeBreakout": "ABOVE_OPENING_RANGE"
    },
    "supportResistance": {
      "support": [2412.0, 2411.2, 2408.6, 2410.5, 2398.0, 2410.5],
      "resistance": [2420.0, 2421.5, 2414.2, 2422.1, 2435.0, 2422.1]
    },
    "timeframeRoles": {
      "direction": "60",
      "structure": "15",
      "entryConfirm": "5",
      "quoteFreshness": "1"
    },
    "methodology": {
      "volumeProfile": "gm_svp_v1",
      "trend": "gm_trend_v1",
      "candle": "gm_candle_v1",
      "volumeProfileKind": "equivalent_internal",
      "proprietaryTrendMeter": "unavailable",
      "proprietaryVolumeProfile": "unavailable",
      "proprietaryTpo": "unavailable"
    },
    "profileDiagnostics": {
      "binSize": 0.29,
      "valueAreaPct": 70,
      "overflow": false,
      "ready": true
    }
  },
  "metadata": {
    "scriptVersion": "2.1.0",
    "alertKind": "STRATEGY",
    "confirmedBarMode": true,
    "diagnosticMode": false,
    "symbolOk": true,
    "chartMatchesStructure": true,
    "partial": false,
    "dataQualityHint": "GOOD",
    "volumeProfileMethod": "gm_svp_v1",
    "trendMethod": "gm_trend_v1",
    "candleMethod": "gm_candle_v1"
  }
}
