{
  "schemaVersion": "1.0",
  "source": "tradingview",
  "eventId": "OANDA:XAUUSD-15-1794902700000",
  "webhookSecret": null,
  "symbol": "XAUUSD",
  "exchange": "OANDA",
  "timeframe": "15",
  "eventType": "BAR_CLOSE",
  "barTime": "2026-07-20T14:45:00Z",
  "sentAt": "2026-07-20T14:45:02Z",
  "isConfirmedBar": true,
  "indicatorName": "GoldMetaBridge",
  "ohlcv": {
    "open": 2417.32,
    "high": 2421.86,
    "low": 2415.74,
    "close": 2420.48,
    "volume": 18472
  },
  "levels": {
    "pocAll": 2416.5,
    "vahAll": 2420.0,
    "valAll": 2412.0,
    "pocNonBroken": [],
    "vahNonBroken": [],
    "valNonBroken": []
  },
  "sessionVolumeProfile": {
    "session": "OVERLAP",
    "sessionStart": "2026-07-20T13:00:00Z",
    "sessionEnd": "2026-07-20T14:45:00Z",
    "poc": 2416.5,
    "vah": 2420.0,
    "val": 2412.0,
    "hvn": [],
    "lvn": [],
    "acceptanceState": "ACCEPTANCE"
  },
  "marketProfile": {
    "tpoPoc": null,
    "initialBalanceHigh": null,
    "initialBalanceLow": null,
    "poorHigh": null,
    "poorLow": null,
    "singlePrints": [],
    "valueMigration": "UNKNOWN",
    "profileState": "UNKNOWN",
    "acceptanceState": "UNKNOWN"
  },
  "trend": {
    "direction": "BULLISH",
    "strength": 72,
    "components": [
      {
        "name": "gm_chart_ema_stack",
        "direction": "BULLISH",
        "strength": 78,
        "sourceTimeframe": "15"
      },
      {
        "name": "gm_htf1_ema_stack",
        "direction": "BULLISH",
        "strength": 70,
        "sourceTimeframe": "60"
      },
      {
        "name": "gm_htf2_ema_stack",
        "direction": "NEUTRAL",
        "strength": 40,
        "sourceTimeframe": "240"
      }
    ]
  },
  "confirmationCandle": {
    "confirmed": true,
    "direction": "BULLISH",
    "candleType": null,
    "classification": "CONTINUATION",
    "open": 2417.32,
    "high": 2421.86,
    "low": 2415.74,
    "close": 2420.48,
    "bodyPercent": 51.63,
    "upperWickPercent": 22.55,
    "lowerWickPercent": 25.82,
    "volume": 18472,
    "isClosed": true,
    "relatedLevel": null
  },
  "optionalIndicators": {
    "atr": {
      "length": 14,
      "value": 5.84
    },
    "methodology": {
      "volumeProfile": "gm_svp_v1",
      "trend": "gm_trend_v1",
      "candle": "gm_candle_v1",
      "volumeProfileKind": "equivalent_internal",
      "proprietaryTrendMeter": "unavailable",
      "proprietaryVolumeProfile": "unavailable",
      "proprietaryTpo": "unavailable"
    }
  },
  "metadata": {
    "scriptVersion": "2.0.1",
    "confirmedBarMode": true,
    "diagnosticMode": false,
    "symbolOk": true,
    "partial": false,
    "dataQualityHint": "GOOD",
    "volumeProfileMethod": "gm_svp_v1",
    "trendMethod": "gm_trend_v1",
    "candleMethod": "gm_candle_v1"
  }
}
