{
  "schemaVersion": "1.0",
  "source": "tradingview",
  "eventId": "OANDA:XAUUSD|1|1794902760000|QUOTE",
  "webhookSecret": null,
  "symbol": "XAUUSD",
  "exchange": "OANDA",
  "timeframe": "1",
  "eventType": "BAR_UPDATE",
  "barTime": "2026-07-20T14:46:00Z",
  "sentAt": "2026-07-20T14:46:01Z",
  "isConfirmedBar": true,
  "indicatorName": "GoldMetaBridge",
  "ohlcv": {
    "open": 2420.12,
    "high": 2420.65,
    "low": 2419.88,
    "close": 2420.42,
    "volume": 412
  },
  "metadata": {
    "scriptVersion": "2.1.0",
    "alertKind": "QUOTE",
    "confirmedBarMode": true,
    "partial": true,
    "dataQualityHint": "QUOTE_ONLY",
    "quoteOnly": true,
    "neverReversesStrategy": true,
    "structureTimeframe": "15"
  }
}
